text,label
i came away feeling a bit sympathetic for her because i don,2
i smiled to myself musing probably feeling superior just as i,1
 i have to admit i am afraid that i cannot do that,1
i feel privileged to have read this work as it fulfilled everything,1
i feel privileged to call them my cousins. i feel privileged,1
i am so thrilled at how many beautiful and talented people there,1
i get angry at myself when i feel bitter. i get,3
i feel that more people ought to use percolated as,2
i feel incredibly nervous about it. i feel incredibly scared about,4
i still feel i have a very long way to go before,1
i just got back from our monthly quilt meeting and i,1
"""i feel like i should be ecstatic and i just want",1
i started to feel cold. i started to feeling cold.,3
i feel helpless and lacking right at this moment all i want,0
i suspect this is a big reason why so many on screen,0
i feel the weight of emotional issues much more now. i,0
 i don t really feel attracted to people who are cool and,1
i was feeling strong and dodging international distance runners. i was,1
i feel that they will hire billy over sasha because,0
i didn t feel excited playing it that s how i d,1
i completed this card a while ago but im not feeling it,4
i have noticed my body has not been to happy when i,0
i feel the sting of the words as a dull ache,0
i feel like ive been to submissive and let too,0
i feel horrible and i would prefer to extend my deepest sorrow,0
"""Mediation only has value if i freely express how i",4
i feel like ive shaken off some of the funk thats,4
i feel more like damaged goods than ever because i burned out,0
i cant talk to anyone about how i feel because i feel,1
i feel like they hated me since then. i feel like,3
i feel that casual fridays are essential to companies that can,1
i feel enthralled by the lyrics and the rhythm.,5
i feel this perverse pleasure in knowing how were so much the,0
"""I'm inclined to think his feeling disturbed is at least",0
"""i was feeling groggy and just wanted to sleep but",0
i am feeling stressed and more than a bit anxious. i,0
When i recently injured my wrist i found the x tremus,1
i know killing myself solves nothing but the hopelessness and sadness,3
 im feeling a little tender swollen and hot in that area today,2
i start to feel less exhausted the bits and pieces of life,0
"""It makes me wonder who exactly is more mature,"" says",1
One of my best friends in high school loved her and so,0
i didn't feel an aching inside. i didn't,0
i feel amped and im inspired. i feel am,1
"""I'm feeling thankful for books york peppermint p",1
 i wasnt going to make this about what i cant eat,0
i am so tired of feeling sorry for myself. i am,0
i was going through a painful breakup and went looking for anything,0
i feel slightly snobbish. i feel  snobb,3
i don't think i ever really thought i d have to,5
i liked boys and didnt feel inhibited by them. i liked,0
i like to think i can handle a lot but when i,3
i feel more relaxed improvising in front of a group of,1
i love how comforted i feel when im around hunters sweet,2
 im feeling this longing for this endless love that maybe we could,2
i told omangy that i was feeling violent and i,3
i wasnt feeling all that hot and i was moving well,2
i cant help feeling agitated about my job. i cant help,4
i somehow have the feeling that heung min son has something,1
"""i feel so restless like i need to be moving around",4
i didn t want to feel the disappointment that i was sure,1
i am close to her i get this complete fuzzy loved feeling,2
 i am not a good cook mind u i feel contented,1
i truly feel terrific. i truly feel wonderful. i feel,1
"""I've known that this person has been miserable for years",4
i feel we re seeing now is a clash between those who,4
i feel so outraged that this could happen in my city.,3
i feel like until my brother is completely fine i wont be,1
i feel cranky already. i feel crankier already.,3
i can t help but feel petrified of the future is,4
"""It makes my face feel soft and smooth like its been",2
i think maybe the person gives a fake hope just because he,4
 im already feeling stressed without trying to sort that lot out.,0
i feel really greedy but i like hogging him. i,3
i hate to interrupt you but the truth is i m feeling,4
i had to cut the lines to make it fit making it,4
i feel that a truly valuable lifestyle is available to anyone here,1
i try to explain how emotionally empty he can make me feel,1
i feel a bit foolish now. i feel like a bit,0
"""Feeling all shitty once in a while is just human",0
i feel and the longing i feel for is the connections i,2
i did something to my back after moving my piano this week,0
 i feel really dumb but also have way more sympathy for people,0
i still feel energetic right now. i still feel energy right,1
 i feel stupid img width height src http voicesfromkrypt,0
"""i do feel that you are a little needy because of",0
 i feel in the long run this hurts paulie as,4
i was feeling so stressed up whenever he doesnt sleeps because i,0
i feel slightly charmed and wishful. i feel slightly,1
i remember two specific things from that class feeling terrified of my,4
i feel all mellow right now but i dont think i,1
i find impressive is that bezos has gone through this routine,1
i feel very regretful for what i might done i dont,0
i feel lethargic and unmotivated in the mornings,0
i really could not feel a thing and i felt slightly annoyed,3
i feel shy when people reading these but i am writing it,4
i am tired of feeling sorry for myself so i decided to,0
As a younger woman i always thought i would be a darling,5
i was supposed to be working on a grant application but feeling,5
i feel a bit stunned actually. i feel like i've,5
i began to feel unimportant useless insecure and i was disconnected,0
Im feeling all puppy dogs and rainbows when im exhausted yes,0
i feel that the pace was slowing and for a book that,1
My grandfather died he lived almost as a recluse not caring,0
i feel like i just cant be bothered. i feel like,3
i feel so low from living high chorus post chorus outro,0
i make this blog post i am feeling the melancholy running through,0
i feel it is vital for google to become a player altogether,1
i went to an lds step meeting and was so overwhelmed,0
i might not feel so cool. i might not be so,1
 i feel awkward and so i start acting awkward lol. i,0
i go back to my village i feel i am really lonely,0
i can think about is how lonely i feel im all grou,3
i feel like hes so smart so i can converse many,1
i get on new years eve but it makes me feel rebellious,3
i feel it was a very valuable lesson. i feel it,1
i feel very shocked by how many people i talk to who,5
i feel angry and disgusted. i feel angry disgusted. I,3
i am afraid that i will feel very regretful at that,0
 i feel like im craving it and then no matter what i,5
Two nights ago i dreamed that we were at my master s,4
 i feel greedy about my work img height src http forums forums,3
i dnt want yu guys t feel shamed fr,0
i don t feel cute like at all. i don t,1
i feel like i have been a neglectful lady. i,0
i am starting to feel compassionate towards roslin again.,2
i feel beyond ecstatic acause i can. i feel beyond,1
i concentrate on anything else when he feels so miserable. i,0
i truly feel sorry for them. i truly feels sorry for,0
"""i can take away from this experience is that slowing down",1
i want to take one of the superior caps just because they,1
i have only taken three rolls shots so far and really i,5
i had a really good first impression of them but i feel,1
 im feeling artistic google art project project. i feel artistic google,1
i have a feeling innocent world and i are going to become,1
i feel as though ive been robbed because much of my,1
i feel the need to be out of the house and doing,1
i merely say i do not feel those activities to be acceptable,1
i was feeling stressed or run down to support the immune system,3
i am feeling generally morose and didnt stop for my j,0
 i went to the doctor a few days into feeling weird.,4
 i feel insulted but i go out with him anyway. i,3
i am feeling very anxious and frustrated right now. i am,4
"""i have a feeling it is soon going to become a",0
i spend countless hours on the computer and feel that processing the,1
i declined this invitation but secretly i could not help but feel,5
 i am feeling clever i see something like this and realize.,1
 i call someone i feel like i need to at least talk,3
i am fascinated with the structure and function of the brain.,4
i marvel at the wonders of life this happened a while ago,0
i always feel as though it is my role in life to,2
i feel the pain but with my family and friends support make,1
i know i will feel quite melancholy this weekend as its our,0
i feel tranquil now. i feel like I'm in a,1
i left feeling triumphant that i had taken the challenge on and,1
i feel sure that this will be a night to remember.,1
i was out until at a social gathering so i feel a,0
i say i m feeling generous so have three winners. l,1
i started explaining what my biggest problems were bottling up my,3
i feel so cold here. i feel socold here.,3
i feel super lucky to have been able to visit it was,1
i had an epiphany that i should feel proud of myself,1
i was pregnant with emily and therefore always feeling exhausted.,0
i have a headache and feel weepy. i have a,0
i used to feel sorry for some people who felt the need,0
i can say that it is happening in the eastern part of,1
i cry when i think of the utter devastation my mum will,1
i had to have something to give the katy and,0
 i feel a bit less burdened with things hanging over my,0
"""I got a feeling she will be just like her mom",3
i just have a weird feeling that there was nothing innocent about,1
"""I wanted to be here and it seems as though the",1
i am ruining her feeling and was disturbed a href http mem,0
i just feel totally devastated. i just feel absolutely devastated.,0
i suggested greys and blues with warm tones as the room,3
i want to be recless but im feeling so uptight,4
"""i just feel this strong desire to know more about my",1
i feel lame saying mommy just needs to pay this bill,0
"""I feel so blessed to have met each and every one",2
i sit in the middle of the most stinking the most,1
i feel also just drained. i feel alsojust drained.,0
i am sorry to hear that the assessment procedure conducted by at,0
i just hate the feeling of being unhappy. i just hate,0
i ranted about not being able to trust anybody and being,0
Do you ever feel resentful for the way your life turned,3
i really hope so i feel so isolated right now. i,0
i am feeling very generous today and normally when i feel that,1
i can feel that the two girls are shocked with what i,5
i enjoy not feeling horny not craving sex. i enjoy not,2
 im sorry but this was the only way i feel these problems,1
i suspect that a few feel revulsion it elicits a,5
i feel a little loyal toward her because her father used to,2
i have a feeling that there will be plenty of football watching,1
The care and artistic flourishes in every minute of this film,1
i told him it was a good drink and made him feel,1
i wanted to use older kx forks wheel w disc brakes,1
i feel to be the most popular right now. i feel,1
i want to do all but i cant help feeling greedy.,3
 i have also added links to other blogs which i feel are,1
i gave them a little something out of my paypal stash,1
 i feel frustrated and can t see a way to save it,3
i feel supportive over chinas copyright violations if only for mach,2
i do feel tia is important to the story. i,1
i had the feeling he didnt and he actually seemed impressed with,5
i walk by those temptations i feel disgusted. i walk,3
i feel really greedy saying that. i feel really selfish saying,3
When i heard the news of the death of my father it,0
i feel like that nurse reluctant to know where to start but,4
 i don t know if i have told this to you but,4
i didnt feel anything more than casual thoughts like hes a jerk,1
i get the philips better lemon chicken. im feeling adventurous,1
i feel punished by my parents. i feel punishment by my,0
 i made a shocking discovery that made me feel incredibly dumb and,0
i remember wearing the dress feeling fabulous looking fabulous announcing my good,1
i hurt your feelings or angered you with my last rant im,3
"""I am now feeling a lot more appreciative of what",1
i feel so dumb witted because i feel like i dont,0
i feel like ive been fairly successful. i feel like,1
i was feeling extremely shitty physically this morning. i was feeling,0
i just hate feeling left out and i wanna be a cool,1
i feel even more strongly now that this can be a valuable,1
When i feel passionate about what i m writing i can actually,1
"""i feel even more disturbed by that than what happened prior",0
. ill feel a little more sympathetic towards them but,2
"""i no longer had to walk through the alleys of",1
i have feeling this is fake. i have feeling that this,0
i can feel from here beloved your fragrance. i can feel,2
i feel infuriated every time that the christmas season draws,3
i should not have to feel this way in a nerd convention,2
i feel a little bit chukey and unfortunately for us,1
i feel that if you love cute little things and your budget,1
i lie in bed or is it a coffin it feels more,0
i am feeling a little intimidated by the riders in central park,4
i was once told that while science explains the how religion explains,1
i feel threatened by not talking about it. i feel threatened,4
i now feel that food is to be enjoyed and not abused,0
i feel pretty posted on a href http playhousecomm.,1
i feel more graceful already. i feel more clumsy already.,1
 i know if ive been feeling quite nostalgic these days and,2
i feel agitated during the speech. i feel damn agitated during,3
i mean its a good level on its own terms but everything,3
"""i didnt feel that angered urge to smack olivia",3
i feel that this leads to not many people caring who get,2
Im feeling a bit frustrated with myself tonight. im feeling a,3
i was feeling pretty grumpy at this point but for whatever,3
 im feeling very uptight right now.,4
i still adhere to this to a certain extent i feel that,1
i always felt like i could do anything but now i feel,1
i also know on certain days when im feeling crappy its only,0
i was so scared of feeling stupid or unintelligent or why,0
 im starting to feel that im suffering from fatigue.,0
i have a creative group of friends i can go to when,1
i am exceedingly lucky and i don t work this hard because,3
i feel a strange connection to them a familiarity that most of,5
i might tackle a memoir but i feel i need to live,1
"""i hang my head down and feel even more embarrassed to",0
i said those who feel unhappy with the way uhuru has,0
 i am starting to feel brave enough and secure enough to put,1
i don t always feel smart sometimes i feel lazy and i,1
i am going to miss running over and putting my hand on,2
Im feeling a little grumpy today with the lame weather tease,3
i could do was feel i felt thankful that her battle was,1
i feel talented i feel amazing. i feel like I'm,1
i feel so nervous about being around people being with someone.,4
i set off home feeling quite smug. i set off back,1
i feel so selfish so self indulgent. i feel so,3
i feel pressured to talk to them. i feel pressure to,4
i just wanted to apologize to you because i feel like a,3
i feel so unimportant to you now its not even fucking,0
i m filled with astonishment and feel amused about what this,1
i was feeling stressed we were all like coiled springs and,0
i think there are quality submissions out there but authors are con,1
i feel like a whore and im ashamed of. i feel,0
i feel bedroom rockers and hardcore music buffs will like the,1
i have this kind of life so my girlfriend would feel very,0
i have been in the advertising world for over years and left,0
i have every right to feel outraged that their legacy may be,3
 i need to do after much prayer considering things like this but,4
i believe him when he says it was a mistake i feel,1
"""i grabbed my shoes no socks too lazy and got on",0
i often find myself thinking why am i having to beg for,2
i can t fit in in beirut where i have,3
i must not be left to feel foolish lost unhappy and with,0
i went back to it because i was feeling so intensely crappy,0
i love tv wall mounts and feel that they are a handsome,1
i think i would have been feeling less grumpy if i,3
i sometimes feel so vulnerable and so lost. i sometimes feel,4
i feel amazed knowing that it had been even bigger. i,5
i pay godaddy for the privellege of having a,2
i feel ugly i look ugly. i feel ugly I look,0
 im feeling funny a href http://www.cnn.,5
This is the source of some of my greatest insecurities,5
i admit to feeling a bit naughty having strayed from an,2
i feel empty and dim if i miss that. i feel,0
i don t feel you all the time and you re not,1
i always tell them to just wear what makes them look feel,1
i feel have wronged me. i feel havewronged,3
i watch this clip every time i feel a bit miserable and,0
i am feeling emotionally and physically exhausted. i am feeling,0
i feel that i am neither of those two types i should,2
i keep waiting for some grand stroke of wisdom and peace to,3
i seriously feel uncomfortable. i seriously feel comfortable. i feel,4
i feel threatened i feel fear. i feel threatened. i,4
i enjoy exercising feeling and looking fantastic amd love having so much,1
i feel you see frantic and thus i am afraid. i,4
i always found there is undiscovered peaceful under the deeper water,1
i feel like ive been defeated. i feel like,0
i am feeling mega pathetic and clingy todayyy. i,0
i would like a lazy immersed in my boring feeling i like,1
i feel that my child will be very handsome or beautiful a,1
i cant describe how im feeling without giving it away but in,0
 i t want t know f t habitual t feel frightened wh,4
i feel like ive gone out of my way to be,2
i couldn t see a future without the pain and i was,0
"""i am very thankful for all the time she put into",1
i feel a little less burdened. i feel a,0
i can run and it feels amazing. i can run,5
i am convinced i would be sucked in to the romantic literary,1
i brought my bomber in that way but i don t feel,1
i feel offended that youre offended way but in the oh,3
i loved the feeling of providing for my little girl feeling like,1
I've been working on my london zine but haven,1
i wanted to root for someone to feel wronged and condemned,3
i started getting back on track health wise and i already feel,1
i remember amsterdam where the circumstances were difficult and i was,0
. hearing about developments of sience in the west a,0
i feel like thats a pretty petty thing to complain about.,3
i write when im feeling in the mood. dont let the,1
i too still believe in feminism and i still believe the saving,4
i cant help but feel suspicious of everything. i cant help,4
i feel even more beaten down without the encouragement and am afraid,0
i want to feel intelligent sexy cute funny. i want to,1
i don t know how to feel any other way about losing,0
i have been feeling so depressed. im not sure if it,0
i don t feel too troubled over work anymore getting used to,0
 im inclined to believe that im simply too lazy to feel particularly,3
i only heard news that made me feel really delighted. i,1
i feel greedy and selfish. i feel selfish and greedy.,3
i could follow every twitch of thought and swell of feeling qu,3
i feel like i am the most creative and talented person ever,1
i feel too smugly virtuous about re using old textiles,1
One night in a hotel room. one night. one,1
i always feel reassured after my appts. i always feel,1
i feel so glad that were chosen in the same batch.,1
i am only confirming that i feel what acker felt or,1
i feel remorseful when i act the drunken fool too.,0
 i think and how i feel and i m kind of proud,1
"""As the leader of the free world you should be feeling",1
i feel delighted when i make good food. i feel delighted,1
i am now feeling much more positive about her agility future because,1
 i have here is that whilst in one turn ill want people,1
i was feeling benevolent and understanding because i said nothing. i,1
i remember feeling hair and being confused my kids dont have hair,4
i was really upset when he went away though i can understand,3
i completely feel sympathetic for my children that suffer mentally because life,2
i feel the isolation and despair of the rejected. i feel,0
i feel dirty. i feel dirty srcurl http draftblog,0
i feel a divine calling to become an lsd chemist.,1
i was feeling aching earlier this morning but not much now,0
i am just kind of left feeling insecure and uneasy in my,4
i hate feeling that a day got away from me and nothing,1
 im feeling cranky im not going to lie. im feeling,3
 im feeling paranoid already. i feel paranoid already feeling,4
i did feel bad for her because she did feel like she,0
i always feel relaxed and happy there. i always feel relax,1
i would feel miserable but i believe this misery comes from me,0
i can see a dramatic improvement in my skills on the dub,2
"""I'm feeling quite positive at the moment. im feeling",1
i read them it is the only point of my day where,1
i always get the feeling that im actually dampening my friends,1
i feel so happy when i eat something that i know i,1
Hanford City Councilman Dan Chins proposed media policy,4
i feel like ive had a pretty productive lazy weekend all,1
You can be paranoid about going bald. id be feeling paranoid,4
i do feel offended and i think justly. i do,3
i feel like this because i start being naughty in order to,2
When i damaged my wristwatch which i liked very much.,3
"""i have had things happen and allowed things to happen to",0
i am left feeling unsure and confused. i am left,4
i know this is supposed to come across as funny but i,0
 i dont really care about just because i can and thats what,0
i have studied logic and ethics and i know with certainty that,1
i took a little liberty here artistic license perhaps and went with,1
i feel listless and unable to imagine ever working again.,0
If she were to ask me out again i would mend it,0
i started feeling like myself again but it was a pretty rotten,0
i love hanging with the kids feeling calm focused and relaxed.,1
i had to change after several months due to the fact that,1
i am feeling very delighted after watching the indian cricket team,1
i get the feeling that i m doing something naughty. i,2
My flatmate was asking questions about my relationship with my boyfriend,3
i returned to the ground floor feeling dazed. i returned,5
i did indeed feel sentimental about this first home of ours together,0
"""i love loving people and when i get the opportunity to",0
"""i still cant make good conversation with and feel awkward around",0
i feel that thursday was the important first step that is,1
i feel this ad does i m not impressed. i feel,5
 i feel that im as curious as when i was a child,5
i can feel that gentle rhythm imprinted on my skin.,2
"""i was feeling paranoid as fuck thinking people would be out",4
i feel accepted for who i am. i feel accepted.,2
i feel tortured with tiredness everyday. i feel tortured,4
i feel like a petty murder shoudlnt be punished,3
i feel so thankful to have been able to be apart of,1
i love the way i just look into her eyes and feel,1
i have realized from this past week is that it is ok,0
"""For some hard to determine reason i am feeling a little",1
i think i could manage one team in jacksonville without,0
i feel defective for not wanting what makes me a woman.,0
i ended up asking my seminar professor is it completely normal to,1
i actually feel really horribly vain posting this but im kinda curious,0
"""i feel sincere respect to the director richard linklater",1
i feel back onto my bed caring for my stinging eye,2
i just feel distressed i dont know why though but i do,4
i feel really stressed out. i feel really stress out.,0
i like this photo of myself because i feel that i look,1
i want to thank you for making me feel a little more,1
i feel stupid typing that. i feel stupid writing that.,0
i was wide awake and miserable at am still feeling like crap,1
i feel like one of those dirty confidential intermediaries that i,0
i am feeling especially irritated. i am feelingespecially irritated.,3
i feel much more relaxed this year said jane pollic,1
 i think i used to overeat i mean one reason anyway,0
i am enjoying the month old puppy piddi and feeling,2
i just want to stop feeling so shitty i feel terrible and,0
 i need her and offers valuable constructive advice when i feel unsure,4
""" im feeling pretty good. ive survived thanksgiving scouts",1
i lock mine with a long lifeline and loop to a,4
i can t help but feel nostalgic every time i listen to,2
i have cried in my loneliness and smoked because i felt like,1
i feel very envious of my friends. i feel very,3
i got up feeling all lively since the sun is extra bright,1
i am feeling quite well this morning. i am feeling,1
i am feeling overwhelmed by god s grace. i am feeling,4
i eat and feel satisfied. i eat andfeel satisfied.,1
i don t have a gigantic fabric stash so each piece feels,1
i feel complacent in my life. i feel compl,1
 im feeling very generous i bought a gift for a too.,1
i feel like this i can look into that sweet face and,1
i would also change the floor to a more pleasant feeling and,1
i just feel disillusioned. i just feel disappointed. i,0
i left feeling pretty chuffed with my finds. i left,1
