text,label
i feel so invigorated when its cold. i feel,1
i feel ive been physically uncomfortable for the last months of,4
i feel more intelligent and strong. i feel like I'm,1
i feel invigorated and enthusiastic. i feel inv,1
i see what being unhealthy does and i can feel the weight,3
The feeling i felt was just an amplified reaction to the way,0
i should just leave him be so he could go on his,0
i needed to feel loved and accepted although i falter.,2
i feel disgusted that any criminal justice system in the st century,3
i tend to feel humiliated when criticized. i tend to,0
i was overwhelmed with joy when i received the acceptance letter to,1
i feel virtuous as ive already done more on it this,1
 i feel that when i run i that is me sarah,1
i will feel the sadness when i am more troubled. i,0
i stared up at him amazed by the feeling and as equally,5
i feel more excitment than reluctant xdd hoh,4
i took a shower then headed to the bsc loop to,1
i got home feeling miserable at my lack of shopping skillzz,0
i honestly feel that im being ignored and left alone. i,0
i guess a lot of her is pretty high even though i,0
i feel that im fine without him. i feel that,1
i do however feel that some people would not be so shocked,5
i am now feeling the onset of an unpleasant sort of tourist,0
i truly felt that when i left friday you were smiling,1
i feel drastically inadequate for the needs i feel swirling around me,0
 i feel you might be quite amazed if ahead of you begin,5
i come home feeling drained and paralysed and when i try,0
i try to get used to the feeling of his touch innocent,1
i lived her life without the feeling of acceptance she felt as,3
 i every once in a while feel free feel free to send,1
"""i feel like in spite of having so many amazing things",5
i feel instantly glamorous just pulling it out of my handbag,1
i feel like if there are pickles in the fridge everything,1
i have a feeling this sketch will be a popular one.,1
Sometimes i just feel so aggravated. im sure this silly little,3
i hope you enjoy reading and please feel free to leave comments,1
i always feel humiliated. i always feel humiliation. i,0
The author gives his name in the opening passages saying it may,1
i feel too overwhelmed to clean anything so i just let it,5
"""You have time to let go of it and love him",5
"""i can see in myself a lot of the older son",1
i feel i can rely on my instincts more than my intellect,1
i feel so doomed all the time. i feel so,0
"""I remember just knowing you were crazy in love with me",1
i feel so foolish i admitted i admitted. i feel,0
i was feeling quite nervous. i was feelingquite nervous.,4
 i want to tell you what im feeling but i dont know,4
 i guess she has opened up and known him longer but i,0
i feel very giggly and upbeat even though i feel like,1
i feel so neglectful of my new followers but all i,0
i am tired of feeling awful. i am sick of feeling,0
i have the feeling i am going to be tortured tonight.,4
i hate when i feel stupid because i dont know these things,0
i am on this track i feel good things coming. i,1
i can t even get my heart rate high enough to feel,1
i feel like i should be thrilled and i am but at,1
"""i feel a hell of a lot more mellow amp",1
The most generous place for charitable donations in the uk is,1
"""i didnt feel safe in my room because the argument was",1
i feel funny about mothers day. i feel funnyabout mothers,5
i have been feeling restless and not quite grounded. i have,4
"""i feel like most books will contain some kind of romantic",2
i often feel like a child here i speak the language like,4
i was able to identify the speed in which f could get,0
i should always be open to opportunities of inviting and involving others,1
i feel like its an excuse for being boring as an individual,0
i take lightly but if youre like me youre probably,4
i feel a little abused about this whole situation. i feel,0
i feel very disgusted by that i cant tolerated her actions anymore,3
 im feeling so emotional today today. i feel so emotional,0
i feel remorseful for my fellow teachers having to go back,0
i don't feel victimized. i don t feel victimized by,0
i do not feel bad about it. i do not,0
i had to be transgender and this very brainwashing attempt is,0
i have that overwhelming feeling of not being good enough recently.,1
"""Some days i feel uber supportive and other days i",2
i don t want to feel the way i did with you,1
i feel pleased about this issue there are a lot of beautiful,1
i was going to feel worthless around skinny people while i m,0
i feel overwhelmed or a little blue usually around that time of,4
i feel like federer is more talented player for sure.,1
"""i choose to do and most importantly someone i can vent",1
"""Words alone are difficult to express their awesomness",2
"""i feeli am pretty loyal as part as shoots go",2
i no longer ask for hugs or for comfort. i feel,0
"""I just really feel content and really don't feel the",1
i think and feel its funny its sad its weird but more,5
i just know that im feeling so hot now. i just,2
i was feeling lethargic hahaha. i was,0
i am designing games it really makes me feel excited. i,1
i think she s one of those people who secretly likes my,1
i couldnt feel worse. im feeling terrible i couldnt,0
i would also hate for you to feel i was selfish in,3
i feel as if her call was not a sincere apology.,1
i determined to have a read of the backdrop and that old,3
i wonder sometimes how it must feel to be rich. i,1
"""There are people in this world that have been so untouched",1
i feel pressured and can not move on to other items in,4
"""i feel sexually threatened because some guys can be assholes",4
i feel homesick near to the end of the last week,0
i even feel punished lately it s really not like that.,0
i am ashamed when i feel like that the moment i see,4
"""I've been angry and under that anger hurt are not",1
i felt like facebook was a catalyst for me to feel that,3
i secretly feel unimportant anyways and as such find people to,0
i am in true victim style feeling shamed for being me,0
 im feeling sociable again i have a date on monday,1
"""i feel shy. ill write a bunch youll respond",4
i pray for those who are feeling unloved and lonely.,0
i am feeling adventurous and extra musical. i am feeling,1
i always loved the blue angels and i feel so privileged and,1
"""I would feel myself being a little bit repressed in",0
i feel like we are supporting her lifestyle. i feel like,2
A few guys who want some naughty pictures and a feeling of,2
i might have folk over soon if im feeling brave. i,1
Bright coloured lipsticks are for when im feeling bold etc.,1
i feel overwhelmed with the uncertainties of life the sorrows lurking,5
i feel jealous with them why they can. i feel jealous,3
i even feel weird living with lay people again. i even,5
i definitely have a ton to learn still and i feel so,1
i first entered the clinic i feel very welcomed by the beautiful,1
i feel weird. i feel weird for a reason. i,5
i woke up feeling more discouraged than i had in a very,0
i will cry in front of my children and feel overwhelmed without,5
i feel so hated by the man that is suppous to,0
"""I've been feeling an awful lot lately. ive",0
i feel frightened by it all. i feel frightened. i,4
 i do a hobble to the bike rack with one bike,0
i feel the gentle press of the seed through the soil.,2
i often feel this is a very unfortunate flaw that i possess,0
i have never been happier nor feel more accepted in my whole,1
 i dont think i would have touched this book if i had,1
i feeling so miserable when actually my mum should be the one,0
"""i let him into my world and he usually does i",3
i feel useless and worthless. i feel useless. i,0
i go shopping now i feel reluctant to buy things like that,4
i sit and remember what longing felt like and what denial feels,4
i almost made my counsellor cry yesterday because i said,1
i cringe when i think of spending years chained to a desk,3
i feel useful again and serves as a reminder that ive,1
i should have known better if you are traveling with the military,1
i have been feeling generally disheartened by my continually plummet,0
"""i can drop a great deal of paratroopers on",1
 i am fucking it up with my pattern of wanting craving addiction,2
i feel a lot of positive intention behind it. i feel,1
i suggest you give it a listen i feel like i am,2
i was feeling a little annoyed at some people. i was,3
i do occassionally miss wearing regular earrings but i,1
i feel hesitant and uncertain sometimes. i feel like i,4
i feel like a blank canvas i have no clue what i,0
 im feeling rather inspired yet low i will enjoy my writing and,1
i feel glad to have mu tou cause only him can tolerate,1
i wonder if they will even think back to the times that,2
When i was years old my father travelled very much for his,0
i feel honored to wear usa on my back. i,1
i feel i might have been too gloomy about it. i,0
i feel for the people who dont see its worth or are,4
 i feel so determined this time and i say this time because,1
Diane von furstenberg rodarte and jason w,1
i have the best conversations and the best time together unlike any,1
i feel extremely lost right now. i feelextremely lost right,0
i don t feel whack or messed up i know i,3
i still miss him and feel rather weepy today. i,0
i feel tortured when i hear them talk or sing or laugh,4
""" im just trusting in my feelings and im trusting god above",1
"""I've lived my life trying so hard to be accepted",2
i can go from elated laughing to plunging back into,3
i always feel awkward. i always feelkward. i,0
 im feeling kinda homesick. i feel kinda homes,0
 im continually feeling triggered im not sure if people are insensitive or,1
i stayed for a short while but feeling like he didnt need,0
i returned not feeling rejuvenated but exhausted. i returned not,0
 im still feeling shaky i realized that i felt intolerably hot,4
i cant really understand my feeling cause its a mixture between bitter,3
i really have no reason to feel gloomy except the fact that,0
i feel inspired to get back to my indigo pot.,1
i feel wonderful and i m very very grateful for all the,1
"""i thought how great it must feel for the author to",1
i did not feel sympathetic as the narrator struggled through her low,2
I've been feelin cranky about my blog.,3
 im getting things done that i really need to and i feel,1
i m drawing a blank as to what this is called to,4
i have been feeling agitated about lately. i have been,3
i want to find my essence and my substance and not feel,4
i sing as one who feels contented with a comfortable life,1
i wasnt feeling like going on easter holidays i dont,1
i am feeling more creative now and am able to think outside,1
i feel rediculous and petty and yet justified. i,3
One of the main things that makes it hard for us to,0
i feel so empty idk i came home early from school,0
i feel weepy already. i feel weepier already.,0
i feel intimidated to go there again at that time for fear,4
i wasn t thinking negatively about any of those things often the,1
Earth Crake is a website that allows users to send,4
i am feeling brave we will go somewhere further afield like,1
i feel even more regretful that i didnt get to go,0
i feel invigorated as i am one. i feel,1
i was definitely feeling nostalgic and was a bit sad when one,2
i am feeling brave and lucky kind of like my heart is,1
i came away filled with admiration inspired by amy s friends.,1
 i write and share my feelings family events useful products good food,1
i have a feeling she is going to be an amazing artist,1
i feel wonderful monroe said upon the launch of her company,1
"""i feel like he is not so keen on the idea",1
i become more comfortable in this remodeled office i am feeling,1
Two simple techniques you can use to almost instantly feel relief from,0
i feel there are some who still wants us together and i,3
i remember feeling humiliated because of the people in the front seat,0
i hope someday when i am again in a position to give,2
 i have for myself even when i m feeling crappy. i,0
 im having trouble coming with words to describe the way i feel,2
"""i always feel like if i cant help myself then i",0
 i dont feel as carefree as i used to and this,1
Stress takes a toll on my milk supply and im not,0
i suppose its odd im feeling timid about leopard. i,4
i feel the corners of my mouth curl into a triumphant grin,1
"""i slowly continue along my little path until i feel need",3
i feel free to create the definition of what i believe in,1
 i range has always been giving you feel reluctant to select your,4
"""We got to be with everyone on the dangerous path to",3
i feel shamed and insulted. i feel ashamed and insulted,0
i was really feeling crappy even after my awesome week of workouts,0
i feel a little dull. i feel alittle dull.,0
 im feeling a bit weepy today.,0
i checked out the lyrics i realized that this song was talking,1
i feel determined to offer her all the possibilities that my parents,1
i love running because i feel strong and powerful and totally in,1
The supplement when used without going to the gym makes me feel,0
i feel pretty fantastic. i feelpretty fantastic. I feel,1
 i go fishing i really feel so carefree can i fish,1
i feel incredibly sarcastic right now. i feel incredibly sarcasm,3
i feel a little discouraged here. i feel like i'm,0
i dunno how it feels to be completely happy the real world,1
"""I feel proud and excited for their parents and them but",1
i do sometimes feel like im in this strange in between world,4
i am writing feeling appalled at the treatment of women. i,3
"""i do have good days and bad days but the bad",0
i feel so pained to see students on a school trip,0
i feel defeated and low. i feel low and defeated.,0
 im so tired i feel weepy. i feel like i,0
i feel as if im doomed for ther rest of mi life,0
i feel like im being taken advantage of and on top of,3
i feel that learning more about animals and the amazing things they,1
i can spill my feelings to and tell every pathetic detail of,0
i can feel them cool but seldom empty. i can feel,1
i refuse to feel guilty. i refuse to be guilty.,0
i am feeling a little sorry for myself and worse for him,0
i was an outsider and i never felt part as i was,0
i lost a very dear friend in the maschke family,0
i feel fine. i feel fine read the rest. i,1
i do not feel that i could ever harm an innocent girl,1
i can t take medication because its triggering i have to be,4
CNN.com will feature iReporter photos in a weekly,0
i am not being faithful to the girl but rather to myself,2
i don t know what to do about it or how to,3
i just remember spending hours trying to bump my score above the,3
i needed this. ive been feeling really energetic at night,1
i seem to see the five years after the chinese pav,0
"""I feel horrible most of the time. i feel horrible",0
i go for my k training or a swim then i feel,1
i feel irritated that he either interrupts my quiet time or wakes,3
i feel like its about supporting something that you believe in.,2
i feel smart and i want to show it off. i,1
i feel quite nervous and scared too x scared cos ill be,4
i couldnt help but feel a little out of place in,1
i simply can t help but feel dissatisfied after reading glancing,3
i cant wait till the summer when we feel somewhat carefree,1
i feel very passionate about this because of children reared within,1
i thought of that feeling of delicious isolation i feel when i,1
i wonder if im doing this parenting thing all wrong. i,0
i began to feel unimportant misunderstood the odd one out.,0
i feel listless and completely unmotivated to do anything,0
i feared i would feel resentful of her or this process,3
i feel any artist that puts forth a piece of work even,1
i even picked out beautiful pearly looking snaps and is soft,2
i tend to lose feel for the water pretty quickly when im,1
i feel calm with her. i feel calmer with her,1
 i feel really pissed off just thinking about it. i feel,3
i feel like it s a boy i would be pretty shocked,5
 i guess a similar viewpoint might be when we feel smug or,1
I've been feeling so jaded. ive been feeling,0
 im actually feeling a little smug. i actually feel a little,1
CNN.com will feature iReporter photos in a weekly,1
i said feeling a little shaky as i stared at the ocean,4
i were saying that we were feeling overwhelmed with our life right,5
i am feeling very inadequate about how to share my feelings and,0
i already feel sleep deprived and short on time but if i,0
Asians are very considerate so whenever a person is not,1
i feel completely agitated. i feelcompletely agitated. I feel,3
i just remember feeling so much pain and being confused and scared,4
i am feeling like painting tonight and simply being creative. i,1
i never feel like i have it perfect sometimes i lean a,1
i feel resigned right now. i feel resignedright now.,0
i feel somewhat relieved but disappointed that of the two qualified venue,1
i felt fine when we got there but after a short while,5
i feel like a bit of a turd that my body,0
i find myself feeling surprised and totally unworthy whenever i see her,5
i feel when you dont talk to me my friend so loyal,2
i just want to warn you that im feeling rather delicate at,2
i will be thinking of each one of you i will be,1
i realised how sick i was of working and feeling and being,0
 i thinks this chiefs ccw should be yanked by the,4
i start to feel ugly unloved poor and unhappy. i,0
i feel about my mommy amp me friends our friendships grew,5
i have always wanted ice cream when i feel lousy. i,0
i feel that i have gotten to know the students pretty well,1
i am feeling quite overwhelmed. i am feelingquite overwhelmed.,5
i can feel the strokes getting harder and faster as i try,0
i am looking forward to getting baptized maybe but not until i,2
. ill be whingeing about how much i ac,1
i can begin to process the emotions i am also feeling from,1
i feel relaxed at airports are the times the do occasionally occur,1
i don t feel superior to people who have made different choices,1
i feel i am not that sociable enough thus for friends,1
i have a feeling i may be popular with the lady folk,1
i have no idea why am i feeling so aching when,0
i really like it when baby text me in sometime that i,2
i will feel triumphant. i will feel victorious. I will,1
i feel like your child is worthless even though they passed the,0
i care very little about impressing people unless its a person,5
i set our kitchen timer for minutes and write until the bell,4
i looked around and once again was disappointed that so little had,3
i feel like i am doomed for the rest of my life,0
i feel if you re learning about your purpose and the workings,1
i have been so busy i feel like i have free time,1
i am made to feel useless. i am told I am,0
i feel to you or dad because dad is pissed about the,3
 i like to do it makes me feel very out of control,2
i feel unhappy it is no help for me that other persons,0
i feel so numb that i wonder whether im still human.,0
i feel like someone s strange uncle trying to break the ice,4
"""I feel like it s going to be something shockingly amazing",1
i read her novels to make me feel relaxed. i read,1
i feel like shes just so distracted but when it comes,3
i feel reluctant to share because my experiences feel incomplete. i,4
i feel totally exhausted and over tired. i feel totally,0
i want to stop feeling so worthless. i want to,0
i hope that by telling them ill find out more about who,0
i feel a bit more loving energy inside connecting with you.,2
 im feeling a little bit melancholy tonight.,0
i feel like it must be a popular choice to have alterations,1
i ran into some friends and kodi has been a complete,4
i feel for the natives who welcomed me and others with open,1
i feel as if she isnt faithful but i dont have,1
"""I feel so horrible that you had to go through all",0
i feel so useless to her because the help i want to,0
i feel so jakun that amused me for whole minutes,1
i am feeling less than glam at the moment. i am,2
i feel in my heart and how much im hurt. i,0
i feel like life is too good to be true. i,1
i would take days that i would feel low tuck them,0
i hate struggling to enjoy life but at the same time i,0
i used to feel frustrated all the time. i used feel,3
i knew i needed to get over there but had been dragging,4
i was feeling beaten up by life yesterday you see i am,0
i was feeling very overwhelmed about what i was going to do,4
i began to feel less anxious. i began to feeling less,4
i feel some super shifting some super circles. i feel some,1
 i started feeling reluctant to go because i wanted to spend some,4
i feel so unimportant which im probably am. i feel,0
i need to remember something feel like it and not be distracted,3
i feel that we are often at the forefront of what soon,1
Im still feeling quite lively. im still feelingquite lively.,1
i quite like to do it standing on public transport or busy,0
i could feel safe enough doing so. i could feel like,1
i wake up feeling triumphant. i go to bed feeling triumphant,1
i feel very apprehensive about the future. i feel very,4
i feel is hostile kinship or mounting nausea did you know,3
i feel like im being punished if i have to sit facing,0
i feel grouchy now the football fans have woken me,3
i feel blessed to see darn good talent right here. i,2
i am starting to feel a bit disheartened with my,0
i feel that my weird way of thinking has been generally consistent,4
i feel so uptight around my family. i feel so,4
i've been feeling very intimidated and overwhelmed by the workload this,4
i have noticed improvement is in the gabapentin and,1
i feel especially passionate about my work. i feel especially,2
 i am worried that you might feel pressured or obligated that was,4
i just feel too stubborn to give up on a dream.,3
"""I started to feel super emotional all the time which was",1
i feel the need to be distracted. i feel the,3
"""As an explorer i feel that the lively room simply does",1
"""i feel the need to divulge info to devoted readers",2
i woke up at around am or am the next day cr,0
i feel amused and kind of tired still in the morning i,1
i don t understand why musicians sometimes feel inhibited. i don,4
i feel shy of my broken english. i feel shy,4
i forgot to take it yesterday so this morning i took two,1
i really loved the day which made me feel such gratitude that,1
"""I feel so regretful not going but i feel so",0
i would feel the speech is successful if its very uplifting,1
i feel super glued to my bed. i feel super,1
i have a bunch of ideas but at the same time i,4
i feel irritated and helpless. i feel like I'm being,3
i walked away from them feeling discouraged about how technology seems to,0
"""i honestly believe that he was and is a very violent",3
i am feeling a bit unsure about some of these im going,4
i was feeling productive. i was feelingproductive. i,1
i mean think about how that would feel that would be stupid,0
""" im excited and i feel like this is a project that",2
"""i experienced that feeling that people get when they are char",1
"""I've been sick ever since bfd but im determined",0
i cant seem to command it a feeling im sure anyone can,1
 im strictly on coke and jo still feeling a tad delicate,2
"""i walked away feeling a little dismayed but ive",0
i am feeling terrific at the moment. i am feeling,1
i feel i must apologise as i was a little giggly,1
Im feeling more stressed. im feeling more stress. Im feeling,0
i feel so hated and useless sometimes i even ask myself why,3
i want to feel affectionate. i want to be affection,2
i am feeling a little adventurous so i will try to see,1
. when they changed my office to another room without,3
i feel sorry for the rest of us in second life who,0
i do feel amused by all the different debates going on but,1
 i really think each and every person can begin to sympathise,0
i feel honored that you accept my invitation. i feel honored,1
i feel like i am in ludicrous speed. i feel like,0
i often feel the need to defend just about anything even in,1
i forgot to feel sentimental about my line being pulled. i,0
i love sunshine havent had much but the feeling of it,5
i prayed for love for the people that i was feeling bitter,3
i feel so pretty and glamorous. i feel sopretty and,1
i asked feeling smug. i asked asking feeling smug i asked,1
"""I feel very privileged to work with such an amazing team",1
i feel i am beyond pissed off disappointed frustrated with myself.,3
i feel left alone. i feel alone. I feel left,0
i ain't shot a bitch since this morning so i m,2
i feel lonely i remember my moms saying. i feel lonely,0
"""i was starting to feel neurotic so my sister who",4
i can t make myself feel joyful but i can focus on,1
i do feel a little needy. i do feel like a,0
i feel as the author is very passionate about his poem.,1
"i instead feel restless. i feel restless, i instead feel",4
i also feel proud of her. i also feel Proud of,1
i suppose thats wonderful because it means that they can learn so,1
i asked feeling slightly wimpy. i asked feeling feeling,4
i had for me to confess my feelings for her but still,4
i know its the lot of the dumpee to feel,3
i feel lonely so unbearably crushingly lonely you are,0
i feel about putting on brave faces that let s get real,1
i was thinking about how you all were watching general conference and,3
 i know and i feel that its time to wake up to,1
i shall have to stay feeling neglectful of all things art,0
i also find that during those times when i feel victimized by,0
