text,label
i didnt feel humiliated. i didnt feel embarrassed. i felt,0
i can go from feeling so hopeless to so damned hopeful just,0
i feel greedy wrong. im grabbing a minute to post i,3
i am ever feeling nostalgic about the fireplace i will know that,2
i am feeling grouchy. i am Feeling grouchy,3
"""I've been feeling a little burdened lately wasnt",0
"""I've been taking or milligrams or times recommended",5
i feel as confused about life as a teenager or as j,4
i have been with petronas for years i feel that,1
i feel romantic. i feel romantic too. i. feel,2
i feel like i have to make the suffering i m seeing,0
"""i do feel that running is a divine experience and that",1
i think it s the easiest time of year to feel dissatisfied,3
i feel low energy i m just thirsty. i feel low,0
"""As a possible proto writer trying to find time to write",1
i do not feel reassured anxiety is on each side. i,1
i didnt really feel that embarrassed. i didnt reallyfeel that,0
i feel pretty pathetic most of the time. i feel pretty,0
i started feeling sentimental about dolls i had as a child.,0
i now feel compromised and skeptical of the value of every unit,4
i feel irritated and rejected without anyone doing anything or saying anything,3
i am feeling completely overwhelmed i have two strategies that help me,4
i have the feeling she was amused and delighted. i have,1
i was able to help chai lifeline with your support,1
i already feel like i fucked up though because i dont usually,3
i can no longer tolerate the effect that bm has on,0
i feel so inhibited in someone elses kitchen like im painting,0
i become overwhelmed and feel defeated. i become overwhelmed. i,0
i feel kinda appalled that she feels like she needs to explain,3
i feel more superior dead chicken or grieving child. i feel,1
i get giddy over feeling elegant in a perfectly fitted pencil,1
i remember feeling acutely distressed for a few days. i remember,4
i am left feeling impressed by more than a few companies.,5
i climbed the hill feeling frustrated that id pretty much paced entirely,3
i can t imagine a real life scenario where i would be,1
i am not sure what would make me feel content if anything,1
i have been feeling the need to be creative. i have,1
 i do however want you to know that if something someone is,1
i feel a bit rude writing to an elderly gentleman to ask,3
i need you i need someone i need to be protected and,1
i plan to share my everyday life stories traveling adventures inspirations,1
i already have my christmas trees up i got two and,1
"""I've worn it once on its own with a little",1
"""i feel very strongly passionate about when some jerk off decides",1
i was feeling so discouraged we are already robbing peter to,0
i was feeling listless from the need of new things something,0
i lost my special mind but don t worry i m still,1
i can t let go of that sad feeling that i want,2
CNN.com will feature iReporter photos in a weekly,1
i stopped feeling cold and began feeling hot. i stopped feeling,3
i need to feel the dough to make sure its just perfect,1
i found myself feeling a little discouraged that morning. i found,0
i feel selfish and spoiled. i feel selfish. i,3
i was stymied a little bit as i wrote feeling,4
 i bag qaf look who s cryin now jacy,1
i feel you know basically like a fake in the realm of,0
i hate living under my dads roof because it gives him an,0
i keep feeling pleasantly surprised at his supportiveness and also his,5
i have this feeling that if i have anymore vigorous sexual activity,1
i feel my mom s graceful warm loving smile as i rob,1
"""I feel in they talk the brother in law is extremely",1
i could feel a gentle tingle throughout almost as if i,2
"""I feel like we are pressured into being young beautiful thin",4
 i began having them several times a week feeling tortured by the,4
i am now nearly finished the week detox and i feel amazing,5
i feel selfish as i read back to my former posts how,3
i know the pain parents feel when an enraged child becomes violent,3
 i have been on a roller coaster of emotions over these supposed,0
i suppose my own truth needs to be shared i havent,2
i was feeling brave when i bought it and clearly when i,1
i am feeling miserable but c i am also the proudest,0
 i figure my family loves us no matter what but around anyone,0
 i don t necessarily think f bombs and sex are necessary in,1
i can feel my ovaries aching talking to me as,0
 i didn t feel like doing much chris and i mostly,0
"""i was given unsuitable images and then feeling blamed for",0
i did successfully manage to stretch a mxm canvas i,1
i think feelings are one of the most important things we have,1
i feel completely honored to be an influence to this young talented,1
i feel angry and firey. i feel angered and fire,3
i feel like a miserable piece of garbage. i feel like,0
 i feel like i need to make a list leanne would,3
i drove dannika to school i was feeling a little,3
i remember feeling so hellip furious with the shooter. i,3
i feel very happy and excited since i learned so many things,1
"""Most show horses are safe and quiet and are handled frequently",1
 i only have a couple of things left to make and at,1
i think about how u could make me feel and realize that,1
i feel so worthless during those times i was struggling finding work,0
i will be able to lay on my bed in the dark,4
i was ready to meet mom in the airport and feel her,2
 im feeling bitter today my mood has been strange the entire day,3
When my mums brother passed away after having been involved in,0
i am letting go of the animosity that is towards anyone that,3
i talk to dogs as i feel they cannot understand words but,2
i feel like throwing away the shitty piece of shit paper.,0
Im starting to feel wryly amused at the banal,1
i find every body beautiful and only want people to feel vital,1
i hear are owners who feel victimized by their associations the associations,0
"""i say goodbye to the fam theyre all sad a",3
i feel that loving her and lily when she was little,2
i alba i feel good and im fitting in. i,1
i feel like i have a ton of catching up to do,1
"""i know how good it feels to look back and see",1
"""I feel kinda ashamed but somehow motivated when i saw kids",0
A few spritz of this toner really helps calm and,1
i hope that you realize how little effort is required to make,1
i am feeling so festive today that i m even going to,1
 finding out that i am not ill not seriously not seriously.,1
i did alright in class but a combination of feeling unsuccessful being,0
i always stick to the rule of not posting anything online that,1
i am feeling all useful. i am feeling  useful.,1
i feel like some of you have pains and you cannot imagine,2
i feel ugly i m more inclined to wear ratty jeans,0
 im not feeling homesick yet so im feeling alright about this,0
i dance i should feel pretty. i dance i feel pretty,1
i workout every morning before and feel fabulous for it. i,1
"""i feel all of this just from her eyes not from",0
i was feeling fabulous until friday morning when i started to,1
i feel honoured to have been able to call them friends to,1
i had begun to feel apprehensive when thick black rain clouds,4
 i had stated to her the reason i feel so fearful is,4
i didn't feel like getting shaken down by the tsa,4
i get into groups i feel really awkward and overcompens,0
i am very excited to finally meet that companion that companion who,2
i feel they are pretty safe on my blog. i feel,1
i feel pretty eager to get it done as i have a,1
i am feeling horny so i ask her that lets go home,2
i think if a poem doesn t put pressure on me i,4
i too feel as if i am a stranger in a strange,5
"""i left to the shower questioning what i feel she was",1
i feel energetic and bouncy i m more than happy to,1
i was still feeling strong. i was still feel strong.,1
i didn't burst into tears or some other devastating release of,1
i wanted to get a pumpkin spice latte this morning but,3
i suppose he feels badly because he was a bit skeptical of,4
i clench to the corners of the bed to feel assured,1
i also feel like i am being selfish in not being grateful,3
i called it god because i d seen god in a book,2
i don t know why perhaps because other girls in the office,3
"""I do not feel miserable at all because my family is",0
i might go get a car wash if i am feeling really,1
i still feel sleep deprived she is almost sleeping through the night,0
"""I just feel really violent right now. i just feel",3
i am bloging again. i am sitting here feeling content,1
i started feeling funny and then friday i woke up sick,5
i feel a need to protect my parents against the witch hunt,0
i feel disgusted to even be associated with this woman by my,3
i laughed then bitterly again but i wasnt feeling bitter.,3
i couldn t know what he was feeling then i thought that,0
i was feeling quite mellow and i wanted a soft easy,1
i told him that maybe i just need time to think how,4
i still feel it does the genre a disservice when stories,1
i always know when i am feeling artistic when i write my,1
i remember feeling really terrified when i was in brazil on,4
i could feel her whimper to the thought of being unl,0
"""If you were ever curious about whats going in my life",5
 im sorry that there wasnt more humor in this post but,5
i feel ive got my foot in the door of the,1
"""i say whatever comes in my mind tell you directly what",3
i feel strange coming back to work after my one day holiday,4
i use dashes instead of colons or semi colons,3
i am fatter because the only thing in my life that,0
i could claim to redeem the genre but it didn t leave,3
i feel so sad and hopeless. i feel so hopeless.,0
"""I'm getting the feeling that my classes are a little",4
i still feel groggy but i have to get up to,0
i have a feeling my view isnt going to be very,1
i want to hold this feeling of shocked awe and wonder forever,5
When i heard a rumour that the st year exam results,4
"""I want to feel valued i do and appreciated i do",1
i know there are days in which you feel distracted. i,3
i use it regularly with relaxing music and always feel invigor,1
 im feeling distracted i tend to practice with my eyes shut as,3
i feel like its perfect a w see youtube has its influences,1
i specifically wanted tango was feeling shy and maks quite,4
i also didn t feel very weird sleeping in my bed while,4
i just wish okay so i was thinking about it earlier today,0
i have lost some weight such that i could fit into a,1
i hope to feel a bit more creative again soon and miss,1
i am no fan of the current president i am a conservative,0
i will enclose her verses on her could not weigh much,5
i begin to feel complacent with my life here. i,1
i feel vulnerable and alone. i feel vulnerable. i,4
 i remember feeling inspired and thinking that it was a fine example,1
i feel like i m always the one getting punished for stupid,0
i really feel that my life is perfect right now and if,1
"""i simply feel contented. im there i simply feel",1
i feel its important to find comfort in solitude meditation or working,1
i think im just being stupid feeling nervous. i think im,4
i feel honored by it. i feel proud of it.,1
i was feeling an act of god at work in my life,5
 i feel im like a bird flying in the air in a,1
"""i have to revise my replies over and over again in",3
i felt sad when a friend of mine died and i felt,0
 i died would alex and matt feel regretful for not,0
i feel that educating families and supporting and educationg mamas,1
i hate being lost. im sure its because when i am,3
i feel like these are very boring sewing makes since they are,0
i have always liked to use the original fragrance to freshen,1
i feel like i talented young man i don t feel talented,1
i feel curious about all this things around. i feel curious,5
i feel the reason were apart of each others lives is because,1
i feel now so uncomfortable with all of them i guess is,4
i feel pretty mellow so far about whatever healing wounding process,1
i wonder sometimes whether i have just added to the antagonism,4
i legs would feel shitty for a few miles but would come,0
 i know its an unfair reaction but i have run out of,4
i seriously feel so blessed for the support that i have at,2
i feel abused and maligned but mostly tired of the nervous,0
i am feeling pretty restless right now while typing this. i,4
Gosman's Harbor is a great place to relax and,2
 i have to admit these hilarious e cards are seriously exactly how,0
 i wrote last year when i was feeling more dull and in,0
i just feel irritable with no motivation what so ever.,3
i feel as a child innocent feelings illustrating a. story.,1
i have the satisfaction of feeling that i m no longer supporting,2
i will start to feel resentful. i will start,3
i will spend my vacation on me no obligations no headaches no,0
i feel herpes coming i would be very surprised at this point,5
i feel so fucked like everyday of my life. i feel,3
"""I worked really hard all year to try to make each",1
i am feeling disheartened with my words as of late,0
i didn't feel like i was being bitchy at the,3
i still second guess myself and still have a terrible time making,1
 i don t feel like eggs benedict i ll have,1
 im feeling my way through and trusting myself.,1
Im feeling inspired by all the summery elements of my favorite,1
i can feel that she smiled i love you even more gorgeous,1
Whenever i feel a pang of blank sickness it is more,0
"""i have a very simple purpose and that is to try",1
i can t say i feel all that sympathetic. i can,2
i was feeling over eager and hopped on to the tube to,1
i go online and i see a friend talking to another one,0
If you ever come across any of my blogs and feel offended,3
i feel like that s so weird that i had cancer that,5
i want to feel safe and well and that maybe just maybe,1
 im feeling cranky so I'm going to post a picture,3
i also think it is puzzling that after this particular administrator has,1
i tried to fill it by befriending people that i knew,2
i feel stressed always. i feel stressed every day. i,0
i remember feeling another cramp but i also ignored it.,0
i hope i feel mellow well fed well slept at peace,1
It takes a lot of effort and positive thinking for me not,0
 im feeling awful because we hung out with my friend and her,0
i feel very relaxed and fine. i feel very relax and,1
i feel the suffering and i really feel the pain. i,0
i go to sleep i feel as if i m giving up,1
i feel like i ve been neglecting my beloved mom blog,1
"""i shalt say we did cos i din feel a thing",1
i just feel terrified like im on the edge of a precip,4
 exams have come and gone and now i have a whole five,0
i feel furious that right to life advocates can and do tell,3
i feel as if i was abused in some way. i,0
 im still paying attention but i feel distracted. im still,3
i started the third block feeling hot and cold and tingly,2
 im hesitant to make suggestions because i feel as if the outcome,1
i feel not too terribly fond of the majority at this precise,2
i can feel myself gaining control over the damaged goods aspects of,0
i was that i bombed that first interview i left the second,1
"Sauces, spices and other non perishables can be",1
i now feel i can advise other dads whose children will soon,1
i feel victimized by the drag on our country with heads in,0
i would feel lucky to call any of the materials and kits,1
 i have been for my bloods which proved the reason i,0
i have my own mind and i feel like my mind is,3
i feel like i love everyone or at least i am compassionate,2
i feel as if i should be punished for neglecting you,0
i feel like it just doesnt capture the beauty of this lovely,2
i feel like i ve lost some of my main roots i,0
i feel like i should just bite the bullet and do it,0
i know i have some obnoxiously immature sounding verbal t,0
"""I just had a terrible nightmare and was feeling a little",0
i didnt want to walk passed there just in case the customers,0
i want other sufferers to be able to find me in,0
i am feeling exceptionally reluctant to go to school tomorrow even though,4
i am so festive this feels so delicious wheeeeee what,1
i am not looking forward to being beaten down to feeling like,0
"""I'm sick of feeling crappy. im sick of being",0
 i feel like i almost convinced myself this is going to be,1
i also wear them when im wearing a dress that makes me,2
i feel a perverse pride in my self control that i managed,0
i feel so impatient so easily annoyed so outraged by the blatant,3
i was positively giddy when the kids left this morning after,0
i feel supportive of him i also cant help but feel jealous,2
i mainly like to text because i feel like i am so,1
i seriouly feel i am not being respected i,1
i feel relieved when i hear the your title as deen,1
i personalities that can feel pain and suffering. i personalities that,0
i would feel more like joseph with walt trusting,1
i was warming up starting feeling a little lethargic.,0
i feel excelent but sometimes theres just nothing to do,1
i wonder if this is what master is feeling i am r,1
"""Things were quite hard at first as my savings were eaten",1
Im just feeling rather sentimental right now and just have to say,0
"""i make myself show up and feel isolated in the crowd",0
i often find myself feeling completely blank while my mother is crying,0
i feel loyal to style. i feel loyal. i,2
i can understand that you may feel youd rather not do,4
i can finally stop feeling listless and like a waste of,0
i know im feeling agitated as it is from a side effect,4
"""I do feel a shift in me to being more positive",1
i am feeling brave enough. i am feelingBrave enough.,1
CNN.com will feature iReporter photos in a weekly,4
i feel clever nov. i feel clever  nov,1
i always spend more money there than i mean to and feel,3
Im feeling really quite angry. im feeling reallyquite angry.,3
i feel kerry didnt do by supporting civil unions and gay,2
i feel really ashamed. i feel like I've done something,0
i feel to have these amazing people in my life. i,5
i finally left feeling judged and ridiculed because i am intelligent.,1
i is starting to feel a bit insulted by this stranger.,3
i have many days where i feel hopeless today the light at,0
i actually feel sorrowful for my family. i actually feel,0
i see women wearing boots i feel envious that i want,3
i will feel what i feel and tell you and together we,2
i go up to her and i say feeling very impressed with,5
i began to feel each of my senses dull until the cold,0
i suspect feel less than fond in private. i suspect feel,2
i was so honoured that this young woman felt comfortable enough to,1
i do have to wonder when you re cast as a cave,3
i feel convinced plus so many diverse price tags that i feel,1
i feel empty when the baby isnt there. i feel,0
i stopped feeling so exhausted a href http provokingbeauty.,0
Im feeling font friendly. im feeling fonts friendly. i feel,1
i had my hand on my beads consciously breathing consciously working to,1
i always feel intimidated by other people especially when they always compare,4
i be made to feel rotten. i will not be made,0
i started feeling hostile and i am checking my hemorrhoids.,3
i love wearing new shoes i just feel so glamourous,1
"""Any feelings romantic or sexual i have successfully hidden from myself",2
i just love the feeling of something warmly hugging you and,1
Im feeling far more mellow than normal. im feeling far,1
i became more dismayed as i studied what people were wearing,1
i just need to not have a unibrow and maybe,1
 im feeling lucky width li style border px list style outside,1
i recall those high school feelings and the longing with which i,2
i woke up feeling confident and watched the bodypump d,1
 i didnt say was that strong feelings always make me skeptical at,4
"""i want to talk to you about but with the limited",4
 i am beginning to feel that theres a good chance i,1
i feel like i have a little more control and can help,1
 i feel like i m on the receiving end of a violent,3
i feel it is worthwhile to document it for people who are,1
i and i are feeling especially thankful for so many small blessings,1
i am hoping the weatherman is right with his forecast of,1
i feel like im just on the edge in this microcos,0
i feel a bit funny actually. i feel like i'm,5
i have learnt nothing else in the last two years it is,1
i am feeling is also a blossoming eager anxiety. i,1
i feel burdened to share it with you. i feel,0
i always want nemo by my side and sleeping without her,5
I'm not feeling the outfit but the heels are gorgeous.,1
i feel confused after that. i feel confused. after that,4
i feel that the session was useful and gave me tools i,1
i feel selfish bringing up our loneliness for a child when i,3
i gave my heart to be heal by lord because he s,2
i feel envious and embarrassed. i feel enviously and,3
i could feel the frantic need in him the need to make,4
i am feeling overwhelmed with the responsibilities of being a teacher.,5
i feel so tranquil right now its great. i feel so,1
i feel frustrated when i have new music and new lyrics that,3
"""The thing that broke me was the feeling of been unl",0
i wouldnt have beared witness to the incredibly well spoken,0
i tend to stop breathing when i m feeling stressed. i,0
i was a smoker for years and quit weeks ago right after,4
A complete and total willingness to experience whatever thoughts feelings and sensations,1
i am already feeling frantic. i am already feel frantic.,4
When i first started writing i pictured it all. i feel,1
i should feel complimented or insulted. i should feel,3
i crave as i fall into submission and i did not feel,0
i feel tender just now and i am fine with that.,2
i feel irritated pissed even like when someone wakes me up.,3
i made it to work but i am feeling a little gro,0
i want to love you but i feel like there some sort,2
i feel is that they are fond of themselves and ok second,2
"""I'm feeling hopeful about this one. ill get round",1
 im starting to feel unwelcome in life and some people can already,0
 i feel absolutely fantastic and i hope baby does too. i,1
i watched the snow fall and accumulate on the conifer trees,1
i feel bitter and just honkerblonked off in,3
i have a feeling that your father already convinced him of that,1
i love and feel passionate about i m living my dream.,2
i play in the rain squeal with glee at the,1
 i am feeling humorous i put cold callers on hold.,1
i just busy myself with other stuffs but never with blogs,0
"""i feel energized and curious again about life about god",5
i feel very privileged but it is also a lot of work,1
Im pretty happy but a little on the nauseated side to,1
i close my eyes i can hear the pitiful wailing,0
i bought a virtually fat free thousand islands and feeling very impressed,5
"""I'm sure that the folks in virginia flor",3
i feel like im putting an innocent man on death row.,1
i wasn t sure what else to do to help her feel,1
i begin to feel that every waking moment is devoted to work,2
i feel is thankful for the lessons i m learning. i,1
i feel such a longing and sadness when i see families with,2
i feel distinctly called in clermont to focus on these,2
i hope you can feel glad that she gave you so many,1
i am feeling pretty worthless right now. i am feeling,0
i feel some of my projects are clever and useful enough i,1
"""If i had continued to think along those lines i probably",0
i didnt feel especially nervous in finland but when we landed,4
 i do feel envious of those with kids at certain moments,3
i was feeling like a pretty crappy mom. i was feeling,0
 im feeling pissed off about my aac or feeling kind of,3
 im not scared at all anymore im fine i feel terrific about,1
i still feel vulnerable around him. i still feel,4
i honestly am not sure how i feel stunned. i honestly,5
i feel when you are a caring person you attract other caring,2
 im then left feeling quite embarrassed as i say that noth,0
i feel unwelcome and out of place buti cant decide if,0
i may or may not have cried when thanking them for making,1
i really want to go buy some yardage of art gallery,5
i feel like shes losing her sense of self to adapt,2
i feel burdened for several loved ones and i miss my,0
i feel is still really low in my abdomen. i feel,0
i feel like i ve been welcomed a tight knit family who,1
i feel this is doubtful. i feel this was doubtful.,4
i usually use smaller legos however this year i have a,1
i get some exercise and feel like im doing something worthwhile in,1
i feel like my life is very rich and fulfilling but i,1
i feel blessed amazed and yes very excited. i feel blessed,2
i feel hesitant about talking about this. i don't want,4
i try to get in at least minutes a day five days,0
i have been feeling beaten down sick and utterly devoid of hope,0
"""It seems clear to me that those involved haven t learned",4
""" communion is of tremendous importance to me personally and theologically",2
 im feeling happy and well. im feelinghappy and well,1
i find myself having much more time to think about myself without,0
i got the feeling brig is sincere and has a very strong,1
i feel like ive had to fake my feelings a lot,0
"""i were feeling energetic so we decided we were going to",1
"""She blamed excesses on the merican dream so seldom",0
i am happpy when i get good results in the field,1
i dont know where i want to work because there will always,0
"""I pop out of the chair feeling like i should be",1
i was really hoping that theyd get far enough ahead of,1
i feel like normally i would be angry because i actually think,3
