text,label
"""i feel as though satan doesnt want these one here",1
i have mixed feelings about this book but at least it looks,1
i feel i can do anything my beloved season calls me hy,1
i have a neutral feeling about two broke girls because while i,0
i know all art animals are lame and i feel particularly violent,3
i feel hated by jim martin s. i feel,3
i am feeling any less submissive. i am Feeling Any,0
 i am concerned that my gut feeling about not dropping aol,1
i feel a bit frightened that you are touching my car while,4
i feel extremely boring. i feel extremely bored. i,0
 i want to shout say something dont just smile all the time,1
i feel deeply humiliated when i read in ari ben men,0
i feel like im getting barely as much free time here as,1
i love drink them i love that medicine because i want to,0
i feel so wronged but what can i do. i,3
 i guess i just need to see how it goes so while,4
i feel relaxed whenever i have the privilege to love and serve,1
Thaiwan has already surprised me with the interesting and enjoyable,0
 i feel irritable or depressed during the course of the day,3
 i went over my feelings she said i am very fearful and,4
 i have no better word to describe the way i feel than,0
i feel all ecstatic every time i see the new old opening,1
i am feeling fairly virtuous. i am feeling pretty virtuous.,1
i would still feel unhappy and sad. i would still,0
i ignored my feelings i ignored myself. i ignored my,0
i listen to the hurricane rain outside the window i feel a,0
i was already packed didn't want to wait around for her,3
i feel that the thighs are being stubborn and not going away,3
i was okay but thats an awful feeling to be falling with,4
i was feeling abused humiliated and insulted by a search that does,0
 i do know is that i always feel festive eating outside.,1
i am in size now and im afrad its making me,1
i feel the need to blog pagetitle from flab,1
"""i feel like it only had created in me a more",3
i imagine ill eventually migrate to the middle but even alone that,3
 i feel lighter ive got more energy and im loving the,2
When i almost walked on a snake. when i almost,4
i did say she could but its just a bit annoying and,3
i sometimes feel like the heroine who is never stressed or tear,0
i am feeling very optimistic after a very hard yet busy year,1
i bit my lip as he slightly whispered this will feel weird,5
 im still feeling adventurous ill develop the others too. im still,1
"""i now feel more confident in pursuing a career in education",4
i feel that my posts have been useful and when i get,1
i feel so much more comfortable when i know all of the,1
i live though it is my husband my children my spirituality my,1
 im feeling horrible. i feel horrible. im feeling terrible.,0
"""I feel in a total partnership with him and that is",1
i feel my gorgeous boyfriend throw me up against the wall of,1
i got to feel carefree on the ice with the cold,1
i need the cantor ministry after you made me feel that,0
i have to emphasize the feeling of lost and found. i,0
i hate holidays i wish they would go away i feel nervous,4
"""i will sit in it relish it love it hate",0
i ran miles in my old custom orthotics and i still,1
i cant help feeling like specifically my weight loss plight however successful,1
"""I've been at the lowest ive ever been feeling",0
i decided to rewrite the fic i was writting known,1
i feel so appreciative to have my life to live.,1
i start to hate the fact that whenever i post anything it,2
i feel he is so talented and so realistic. i feel,1
 im feeling so distracted recently recently recently.,3
i feel really fucked up still. i feel really screwed up,3
 i can tell you that i feel oddly vulnerable and disj,4
i started to feel a sweet feeling of peace. i started,1
i think i still feel numb. i think I still feel,0
i find a surprising amount of relief from cleaning and decluttering,4
i feel a bit safer now in using the motivator that,1
i really struggle feeling valuable just staying home i know it is,1
 i feel but i m trying to be stubborn and ignorant at,3
i promise to respect my personal boundaries acknowledge that i am a,0
i know lloyd very well he lives in my street and,2
i still have a lot of my normal symptoms sore boobs constant,1
i only have a few hours of sleep i still feel i,1
i feel passionate about and dating is a passion of mine.,2
i can feel the sweet euphermal scent of justice,1
i was left feeling foolish all alone in the rain. i,0
i don t get it you ate because you wanted the good,1
 im still not feeling too keen on the whole billy de,1
i feel cool reading this book especially when i take it along,1
i leave sundays feeling utterly drained with not an ounce of,0
i was already nervous about this match but by the time i,1
i get the feeling that i impressed ecker. i get,5
i used to go to rock festivals in high school to feel,1
"""i feel so miserable already that i dont think i could",0
Beware here be spoilers and music that im loving to listen,2
 im feeling pretty discouraged this morning. im feelingpretty discouraged,0
i love kitties and i kind of feel like spiders,0
i think feeling insulted was a good thing maybe if we all,3
i feel like i have missed out on every single holiday last,0
i do love the inverted suspension though its the only one that,1
i could feel myself being pulled in as if some evil vampire,2
i am healthier when i don t feel horny often. i,2
i feel like everything i have ever valued is now stripped.,1
i keep feeling like i should pinch myself to make sure its,1
i wont go on into a full in depth review of it,1
i am still feeling some low energy and effects of stress.,0
i end the day feeling hopeful and relaxed. i end the,1
i get the feeling hes pretty proud of his work. i,1
i generally don't eat a lot of junk it is mostly,3
i feel exhausted drained this conversation has really taken it out of,0
i often feel i have nothing to lose so i will try,1
i made an appointment with a friend to drink coffee toge,3
i feel bad not giving due credit for my work. i,0
i feel to be the five most important holiday films of all,1
i don t want anyone to feel inhibited if their bodies are,4
i feel so disgusted and ashamed of myself. i feel so,3
i feel like i instantly became an addison reed super,1
i feel passionate about what I do. i'm passionate about,2
i feel like everything i get is waaaaayyyy,2
i feel as sweet as a centuries old cake. i feel,1
i can still recall the feeling of peacefulness her tender smile,2
 im currently getting out a bit from reality exams amp works and,1
i like the idea of wearing things that are comfortable and make,1
i feel very satisfied to have gone through this challenge. i,1
i have a feeling he is much more talented than i am,1
i will try not to feel rushed along with others or busy,3
i am feeling good and the runs feel normal. i am,1
i could feel my body start to shake with nervous anticipation.,4
i feel selfish at times for wanting an escape from my day,3
i sometimes feel very vulnerable. i sometimes feelvery vulnerable.,4
i sometimes had the feeling she wasn t being entirely truthful with,1
i stop being so reactive every little time i feel wronged,3
 i frantically try to get it done and now feel frantic as,4
 im kind of at a stage whereby im feeling disillusioned about,0
i walked away from that encounter feeling blessed too. i walked,1
i look in the mirror these days i do think i look,0
i am feeling weird and feel wanna know. i am feeling,4
 i think i still will be when they arrive and that makes,0
i had a feeling i had them but decided to buy them,0
i am feeling somewhat satisfied with myself for finally finishing an a,1
i plan on relaxing in the lounge for an hour in front,1
i can process everything properly but im feeling more positive and able,1
i woke up feeling pretty energetic but after i did yoga and,1
i equally feel relieved that i was not a hardcore supporter of,1
i cross the finish line i want to feel exhausted and alive,0
 im feeling jealous just thinking of you all wrapped up all clean,3
i suddenly feel like some kind of innocent virgin. i suddenly,1
i don t feel like teaching it s simply because there are,1
i was a tad more jaded stopping the booth rep from,5
i feel devastated disgusted and betrayed. i feel devastated and betrayed,0
i feel pretty awful about that. i feelpretty awful about,0
i feel like i didnt need to grasp onto something comfortable that,1
i rarely consider the garments i m going to put on every,1
i feel so all alone no ones gonna fix me when im,0
i feel pretty beaten. i feel pretty beat up. i,0
"""I'm addicted to the way living a healthy and fit",1
i feel like this author is a little underrated considering how creative,1
i stopped looking for a solution to my problem and i stopped,3
"""i was feeling very passionate and connected to treating the population",1
i have a feeling i will be making a few more architect,1
i am home again and feeling somewhat the dull girl not sure,0
i would recommend it strongly for any who feel isolated or lonely,0
i end up feeling exhausted for all the rest of the day,0
 i feel reluctant in applying there because i want to be able,4
i am afraid to accept the possibility that he might not make,4
i am still working on how to get past feeling deprived by,0
i have a curious feeling that benjamin button is the next,5
i feel so relieved but at the same time i feel so,1
 i have no i am super to think but the small pist,1
i think another reason i love concerts is it is the only,1
i was feeling pressured but it looked awful to have my make,4
i am feeling tranquil today. i am feeling tranquility today,1
i feel so unimportant right now like i am not worth,0
i have been in a rare organising mode brought on by to,1
i feel like a mellow week of tidying and cleaning,1
 i arlovski on ufc win i feel really horrible,0
i feel victimized like im getting robbed. i feel victimized,0
i hope you don t run around irrationally killing people,4
 i try and try to keep up with other bloggers and read,3
 i make a piece that i feel is unsuccessful ill dismantle it,0
i am sure that i will feel a lot more positive once,1
i feel like i m in a frantic race with the clock,4
i feel it is too dangerous to invest in such markets.,3
The beet and rabiola fresca ravioli and the,1
i feel like im half a person at the moment because i,1
"""i m too busy feeling depressed or elated or a",0
i wear my perfume i feel elegant and beautiful. i wear,1
i hate feeling this loyal to this damned company. i hate,2
i feel guilty and sorry to them for what they have done,0
i had a strange dream last night and woke up today feeling,4
i often feel very angry seeing these things around. i often,3
i left the meeting feeling a little hesitant about the situation.,4
i do really feel treasured by you too. i do,2
i strongly feel that these are valuable human resources who could actually,1
i woke up this morning feeling very agitated at the day coming,3
i also feels at times that i am somewhat socially isolated.,0
i also had my first slice of xmas cake today so,1
"""i feel that chris is not too impressed with my",5
i cough alot more and feel somewhat irritable at times.,3
i was experiencing a ton of pain in my leg muscles and,0
A scene in a film in which one man repressed another,3
i have now finished my blanket and am feeling a little free,1
 i possibly understand what she was feeling i ignored her words ignored,0
i wasn t thrilled to be in training again ha. i,1
i feel kind of pathetic that i have such a hard time,0
i am lost distraught and mainly at a state of feeling helpless,4
 i mean when i say i used to feel like an ugly,0
i feel like cupcakes might be getting a bit too popular,1
i feel empty inside iphone wallpaper mobile wallpaper a href,0
i feel this is just another clever ploy played by ashraf,1
i just really feel so curious about whether you and dad have,5
i have tried to explain my feelings but he replies that if,0
i feel like im gonna be so greedy with him cuz,3
i feel like crap for being ungrateful. i feel,0
i had been feeling fairly strong movements and kicks towards the outside,1
 i feel quite proud of myself this month as i managed to,1
i feel some people go a little overboard with a cake face,1
i ask myself why does the hip hop generation of african,1
""" i understand where they are coming from and why they feel",1
Im lying in bed writing this feeling exceptionally smug about the fact,1
i listen when he tells me he has an ominous feeling but,0
i always feel as if i take something worthwhile away from it,1
i am so desperate to save her that i feel i will,4
"""I feel so blessed to be a part of your days",2
i was actually going from point a to point b but it,1
i feel like that wall is boring amp needs a pop of,0
i would add when i m feeling optimistic but a perfectly average,1
i know that he hasnt even heard what i was saying,0
i am feeling determined to finish that bedroom. i am feeling,1
i can not help this feeling i am more considerate care,1
i didnt really feel like being thankful. i was too busy,1
i feel like ive been spending a lot of time running,4
i feel guilty leaving an f. i feel guilty leave an,0
"""i do love life and i do love to laugh and",3
 im not completely sure my topic is narrow enough and im feeling,4
i dream of jeannie i could still feel the violent grip,3
i woke up feeling terrific today and my head is so clear,1
i begin to feel even more agitated as i realize that ke,3
i resented being made to feel like a bad person for,0
i wish for each one to feel with my loving embrace ready,2
"""I wouldnt be lying. ive been feeling quite",0
i feel like an idiot around my friends. i feel like,0
"""I'm going to take my driving test. going to",4
i know myself and see how entrenchedly selfish i can be,1
i feel like its resolved whereas before there was some negativity there,1
i do stay though it would be six more months of feeling,0
i have been home for days now and am in a space,1
i am curious how the leadership of the catholic church will,5
i needed but i m feeling greedy. i needed but I,3
"""I have to do something that i feel is worthwhile to",1
i feel hurt just thinking about it. ive avoided thinking,0
 im feeling a little groggy today after a bit of a,0
i stood inside the chabad sukkah watching the sunlight,2
i feel awkward saying such things about myself. i feel awkward,0
 i feel some sort of disdain that im ashamed to even verbal,0
i feel confident that my prayer will be granted. i feel,1
i sometimes feel ashamed that i only care about my imagi,0
i feel especially playful so play we will. i dont work,1
i am appalled that i feel violent toward another human being.,3
i am very glad they came and glad i risked feeling foolish,0
i as many others are feeling helpless that we as a world,4
 i havent had dinner but im also feeling pretty letharg,0
i usually feel energized i just felt exhausted. i usually,0
i still resent paying dollars for a procedure that wasnt fully,3
 im feeling less annoyed with him. i feel less annoyed,3
i feel gracious for the opportunity to make a difference. i,1
i admit to feeling slightly alarmed that her book was also based,4
i hate the feeling that i can t do anything useful.,1
i am feeling a bit miserable or passionate about something its all,0
i was feeling restless no one was home and it was sunny,4
i feel paranoid because nobody is saying anything. i feel paranoid,4
i am feeling so blessed so happy. i am feeling,1
i feel stupid the pointlessness of the cu. i feel,0
i feel selfish for that choice i made i just beg that,3
 i feel however that this administration is so dangerous i have no,3
i feel rather disheartened suddenly. i feel rather,0
"""I feel like the distance and time apart would cause people",2
i feel like a failure like i m so fucked up that,3
i feel petty jealousy or anger yesterday in the face of my,3
i know are feeling alone. i know are feel alone.,0
i feel aching all over my body. i feel a,0
i still get excellent feedback from unlikely people friends of my parents,1
i will make you feel amazing tonight i need you no.,5
i will give proper praise to the amish for being punct,3
i think i was addicted to feeling miserable and inadequate especially through,0
i feel about it has me shocked. i feel about how,5
i wish that the girl he asked to prom had accepted his,4
Great acting impressive directing not a movie i ever want to see,3
i feel angry alone unwanted vexed irritable all the time,3
i feel hateful of everything suddenly. i feel hatred of everything,3
i feel humiliated said mohammed hussein a year old,0
i thought maybe i can get through this but now today and,0
 i feel a cold coming on or drink a little extra x,3
Red may be the color of love for a reason it makes,2
i often feel dull and empty inside like i m nothing more,0
i feel like i have an uncomfortable limit. i feel like,4
i dissect every new fact that comes to surface i feel more,0
i feel popular special and important. i feel popular and important,1
"""i really want this challenge to be a fun way for",4
i feel defective because i can't do what other people can,0
i feel comfortable running two miles i shouldnt have a problem,1
i am feeling grumpy i put this on. i am,3
i havent been feeling very well. im very very very,1
 im feeling romantic lately so i decided to go with this nail,2
i was exceptionally hurt by it and i m definitely still feeling,1
i feel so honored to have lindo guest starring on,1
i feel like the one who is being blamed and the one,0
i feel really terrific so far so far. i feel really,1
i feel completely shaken up. i feel completely shook up.,4
i feel lethargic and crave junk food and pop.,0
i always jumble words and letters and i feel like the,0
""" im temporarily wounded feeling like an idiot and have already missed",0
i told justin a couple days ago that im feeling better,1
i like about this song is how it feels bouncy and,1
 skype probably is the safe mainstream option. i feel been,1
i would very much like to come back here at a quieter,1
i don t feel any safe. i don't feel any,1
i found myself feeling inhibited and shushing her quite a lot,4
i feel embarrassed that im doing it because i think people like,0
"""I was able to be myself and not feel pressured to",4
 i did take a surprise two hour nap this afternoon though and,0
 i am trying really hard because i really want to feel faithful,2
i only feel irritated by it. i only feel irritation by,3
 i can feel superior on that point.,1
i said that dancing makes me feel vaguely elegant. i said,1
"""i get what shes saying but on another i feel",3
 i am on the write track i feel contented and at,1
""" arun has these single line solutions to all my problems",3
"""i feel like god pooped on me laughed amp then",1
"""I've been feeling kind of gloomy. im moved in",0
i feel terribly burdened to have to deal with the results,0
i ended up feelin shitty in mind. i ended up,0
 i just posted when i reached to someones facebook that i,5
i don t know why this would make me feel shy.,4
i am not amazing or great at photography but i feel passionate,2
i feel pathetic to be so overpowered by fear. i think,0
"""I just feel complacent and not at all like bothering",1
i feel like hes trying to be the one to comfort me,2
i remember last summer feeling so overwhelmed. i remember last,5
i drink into my feelings get numb. i drink into,0
 i have to have it done but i feel terrified of another,4
i am feeling very valued today. i am feelingvery valued,1
i know it seems very sudden to everyone but i am not,2
i am starting to feel the strain of not having enough time,0
i don t feel resentful i feel guilty. i don,3
i feel like a whiney lil girl who s keeps whining,0
i miss our talks our cuddling our kissing and the,1
i feel very low already. i feel veryLow already.,0
"""I'm more scared of like dramas or thrillers that",0
i did feel a connection between the two of them i wasn,1
i am feeling a little nervous and anxious but never second guessing,4
This was my first experience with an icky racism that prev,0
 im not sure why today i feel so horrible. i feel,0
i didnt feel so hot. i didnt feel like I was,2
i want to keep feeling strong yet i cant neglect that feeling,1
i am sure that if another group came along that made her,1
The world could have one heck of a pacesetter on,1
i am able to replace fear of people with love for them,1
"""i feel like im being punished for being a free spirit",0
i got a good feeling from the school and i have a,2
i feel very reluctant to blog during my free period even when,4
i longed for a companion i could feel entirely devoted to,2
i binge eat to cope with what i cannot control feelings and,0
i get the feeling that my supervising teacher is overwhelmed and,4
i've been feeling very lethargic with the fact that,0
"""i get to this store and feeling almost defeated i tell",0
i feel as much disturbed as much a fool as as that,0
 i had never read the posts i never would have spent the,3
i feel certifiably idiotic right now. i feel,0
i joke about her leaving me or tell her that i know,4
i was bursting to feel the inside of this delicious woman s,1
i have a sick feeling that our hour bus adventure will be,0
i have also known the pain of feeling worthless too broken too,0
 i just take what i feel like would taste delicious and start,1
i feel it is important to support young people in their creative,1
 i didnt feel like i missed out one bit. i didnt,0
i send good energy and light into the universe it feels good,1
i was washing the trees hoping it would do some good.,4
i feel homesick i read this collection of stories. i,0
 im sharing our school room because im sure im not the only,1
i feel so disappointed. i feel so disappointment. i,0
i feel like especially in the art world we could all do,0
i dream of the day that ill be called upon to fashion,2
i feel rubbish today having a bad cold and cough really isn,0
i feel very honoured that i evoke so much emotion in you,1
"""I feel like nobody is giving me a chance to explain",1
 i have to say i feel slightly envious of jul,3
i would go up to my bedroom feeling depressed. i would,0
i feel like oh please why im so fake again but the,0
 i havent hopped on one yet but i definitely will.,1
i don t know why that surprises me because whenever i get,1
i feel so nervous anxious and i dont know why. i,4
i feel emotional about how people have treated me over the last,0
i feel thats a valuable piece of consumer knowledge and one item,1
i continue to explore these sites i feel like they would be,1
i wanted to capture a realistic view of the animal whilst also,1
i am feeling a little weird as i compare this big old,4
i would be feeling guilty of writing craps on my blog,0
i feel your pain whether you want me to or not.,0
i feel horrible rel bookmark permalink permalink. i feel,0
i wake up hobble over to the computer or turn over,1
i decided to focus on how i was feeling and what needs,1
i reply feeling suspicious. i reply feelingsuspicious. i,4
i was feeling awful friends before i left for my dads.,0
i found some four ply tweedy yarn from rowan,1
 im feeling more vulnerable writing about this than i do writing about,4
 im exhausted in excruciating pain and feeling extremely hostile. im exhausted,3
i feel an important experience for short term mission groups. i,1
i feel proud now. i feel proud of myself. i,1
i could set all these discouraging feelings free. i could set,1
i love you all d pagetitle superman mereka,0
i feel amazed to say that i am doing what i only,5
i feel very bitter that i am supposed to be providing this,3
""" im feeling really thankful for everything ive been blessed with",1
i can sense a big transparence burden was lifted,1
"""You make me feel like im worthless. im stupid and",0
i am mostly feeling contentedly terrified about it all. i,4
 i stand you come across as a complete stranger to me but,2
i feel nevertheless not convinced which g is the be all and,1
i can remember feeling petrified when I was a little girl,4
i was able to feel everything and exactly where my sweet boy,1
i left feeling quite dissatisfied with the whole thing specifically that she,3
 im thinking about death at the moment and feeling really sad because,0
i feel shamed into going to school after reading jamies,0
i thought made the room feel playful and kid friendly. i,1
"""i wear makeup not only to reflect how beautiful i truly",4
 i feel very distressed because i m supportive of this campaign and,4
i was feeling resentful and daydreaming about the various,3
i feel ungrateful for being unhappy but i cant seem,0
i feel the self pressured expectation to keep up to date with,4
i guess yelp wouldnt be a useful website if,0
"""i do feel the need to mention the realism of the",0
i drafted this post at least a month ago and now i,4
Every time i meet a certain dog that has once bitten me,4
i feel like i was suckered into buying the iph,1
i hadnt anticipated happening quite so quickly in this new international,2
Im feeling very petty right now. id be less than honest,3
My mother did not come home till late at night ages ago,4
i feel like watching equilibrium or something equally delicious and playing the,1
Im reduced to tears and can barely begin to put my feelings,1
i've been feeling weird because i am weird. ive,4
i usually wash my hair every other day and after a few,2
 i understand why bernie wants a guaranteed spot on the,2
i cant continue to be the whipping post for someone who feels,0
i have the feeling in my mind that a person gets when,1
 i do when i m feeling a bit weird to reground,5
